{
  "$schema": "http://json-schema.org/draft-07/schema#",
  "$id": "https://clawrocket.dev/contracts/editorial-room/v0/pcp_provenance.schema.json",
  "title": "PcpProvenance",
  "description": "Provenance for theme/topic/point pages derived from PCP (personal-context primitive) seeds. See EDITORIAL_ROOM_CONTRACT.md §3.9.1.",
  "type": "object",
  "additionalProperties": false,
  "required": [
    "schema_version",
    "derived_at",
    "source_skill",
    "source_run_id",
    "source_optimization_round_id",
    "pcp_window",
    "pcp_types_used",
    "seed_events",
    "user_promoted_at",
    "user_promoted_by_user_id"
  ],
  "properties": {
    "schema_version": { "const": "0" },
    "derived_at": {
      "type": "string",
      "format": "date-time",
      "description": "ISO timestamp the PCP context was sampled."
    },
    "source_skill": {
      "type": "string",
      "minLength": 1,
      "description": "e.g., 'factory_theme_propose_optimize'."
    },
    "source_run_id": {
      "type": "string",
      "minLength": 1,
      "description": "ULID of the run."
    },
    "source_optimization_round_id": {
      "anyOf": [{ "type": "null" }, { "type": "string", "minLength": 1 }],
      "description": "ULID of the round when the run was wrapped in run_optimization."
    },
    "pcp_window": {
      "type": "object",
      "additionalProperties": false,
      "required": ["from", "to"],
      "properties": {
        "from": { "type": "string", "format": "date-time" },
        "to": { "type": "string", "format": "date-time" }
      },
      "description": "ISO interval the PCP context covered. Runtime invariant: from <= to."
    },
    "pcp_types_used": {
      "type": "array",
      "items": { "type": "string", "minLength": 1 },
      "minItems": 1,
      "description": "Subset of the PCP types consumed (e.g., ['calendar', 'linear', 'work_this_week'])."
    },
    "seed_events": {
      "type": "array",
      "maxItems": 10,
      "items": {
        "type": "object",
        "additionalProperties": false,
        "required": ["pcp_type", "event_id", "timestamp", "summary", "contributed_to"],
        "properties": {
          "pcp_type": { "type": "string", "minLength": 1 },
          "event_id": { "type": "string", "minLength": 1 },
          "timestamp": { "type": "string", "format": "date-time" },
          "summary": {
            "type": "string",
            "maxLength": 200,
            "description": "Human-readable summary surfaced in the ProposalCard. Raw PCP body content is NOT carried here."
          },
          "contributed_to": {
            "type": "array",
            "items": { "type": "string", "minLength": 1 },
            "description": "Which artifact-attributes this seed influenced (e.g., ['theme.description'])."
          }
        }
      }
    },
    "user_promoted_at": {
      "anyOf": [{ "type": "null" }, { "type": "string", "format": "date-time" }],
      "description": "Set when user promotes from scope:personal to scope:organization|global."
    },
    "user_promoted_by_user_id": {
      "anyOf": [{ "type": "null" }, { "type": "string", "minLength": 1 }]
    }
  }
}
