{
  "schema_version": "0",
  "derived_at": "2026-04-22T15:30:00.000Z",
  "source_skill": "factory_theme_propose_optimize",
  "source_run_id": "01HXYZABC123DEF456GHIJKLMN",
  "source_optimization_round_id": "01HXYZABC456PQR789STUVWXYZ",
  "pcp_window": {
    "from": "2026-04-15T00:00:00.000Z",
    "to": "2026-04-22T15:30:00.000Z"
  },
  "pcp_types_used": ["calendar", "linear", "work_this_week"],
  "seed_events": [
    {
      "pcp_type": "calendar",
      "event_id": "cal_evt_2026_04_22_hooded_horse",
      "timestamp": "2026-04-22T14:00:00.000Z",
      "summary": "2026-04-22: meeting with Hooded Horse re: indie deal terms",
      "contributed_to": ["theme.description", "theme.name"]
    },
    {
      "pcp_type": "linear",
      "event_id": "lin_iss_DEAL-142",
      "timestamp": "2026-04-19T09:15:00.000Z",
      "summary": "2026-04-19: Linear DEAL-142 'Track post-Embracer MG patterns' moved to In Progress",
      "contributed_to": ["theme.description"]
    },
    {
      "pcp_type": "work_this_week",
      "event_id": "wtw_2026_w16_focus_publisher_economics",
      "timestamp": "2026-04-20T08:00:00.000Z",
      "summary": "2026-W16: focus area set to 'publisher economics' for the week",
      "contributed_to": ["theme.name"]
    }
  ],
  "user_promoted_at": null,
  "user_promoted_by_user_id": null
}
